{
  "schema": "pqc/episode@1",
  "id": "C01-E003",
  "campaign": 1,
  "episode": 3,
  "title": "The Empty Housing",
  "seed": "C01-E003-1",
  "attempt": 1,
  "status": "scripted",
  "in_world_date": {
    "year": 1047,
    "month": 9,
    "day": 4,
    "hearthday": null,
    "time_of_day": "noon"
  },
  "checks": [
    {
      "id": "c1",
      "actor": "tamsin",
      "skill": "sleight_of_hand",
      "ability": null,
      "dc": 13,
      "roll": "r0000",
      "success": true,
      "reason": "Work open a frost-stiff Lamplighter housing catch by hand while Ilsevel is still looking for the key, with three people watching.",
      "offscreen": false
    },
    {
      "id": "c2",
      "actor": "ilsevel",
      "skill": "investigation",
      "ability": null,
      "dc": 14,
      "roll": "r0001",
      "success": false,
      "reason": "Read the inside of an empty lantern housing: tool marks, the cradle clasps, frost patterns. Ilsevel knows lantern-craft from the Hall's books, but has never seen a core stolen.",
      "offscreen": false
    },
    {
      "id": "c3",
      "actor": "brannoc",
      "skill": "survival",
      "ability": null,
      "dc": 13,
      "roll": "r0002",
      "success": false,
      "reason": "Read a goblin trail on trampled earth in failing light: how many, how old, carrying what.",
      "offscreen": false
    }
  ],
  "encounters": [],
  "rolls": [
    {
      "id": "r0000",
      "index": 0,
      "seed": "C01-E003-1",
      "kind": "d20",
      "notation": "1d20",
      "purpose": "c1: Work open a frost-stiff Lamplighter housing catch by hand while Ilsevel is still looking for the key, with three peo",
      "actor": "tamsin",
      "target": null,
      "draws": [
        {
          "counter": 0,
          "sides": 20,
          "value": 6
        }
      ],
      "rolls": [
        6
      ],
      "kept": [
        6
      ],
      "modifier": 7,
      "total": 13,
      "advantage": "none",
      "natural": 6,
      "dc": 13,
      "success": true,
      "critical": false,
      "fumble": false,
      "rerolled": [],
      "notes": []
    },
    {
      "id": "r0001",
      "index": 1,
      "seed": "C01-E003-1",
      "kind": "d20",
      "notation": "1d20",
      "purpose": "c2: Read the inside of an empty lantern housing: tool marks, the cradle clasps, frost patterns. Ilsevel knows lantern-cr",
      "actor": "ilsevel",
      "target": null,
      "draws": [
        {
          "counter": 1,
          "sides": 20,
          "value": 6
        }
      ],
      "rolls": [
        6
      ],
      "kept": [
        6
      ],
      "modifier": 5,
      "total": 11,
      "advantage": "none",
      "natural": 6,
      "dc": 14,
      "success": false,
      "critical": false,
      "fumble": false,
      "rerolled": [],
      "notes": []
    },
    {
      "id": "r0002",
      "index": 2,
      "seed": "C01-E003-1",
      "kind": "d20",
      "notation": "1d20",
      "purpose": "c3: Read a goblin trail on trampled earth in failing light: how many, how old, carrying what.",
      "actor": "brannoc",
      "target": null,
      "draws": [
        {
          "counter": 2,
          "sides": 20,
          "value": 4
        }
      ],
      "rolls": [
        4
      ],
      "kept": [
        4
      ],
      "modifier": 3,
      "total": 7,
      "advantage": "none",
      "natural": 4,
      "dc": 13,
      "success": false,
      "critical": false,
      "fumble": false,
      "rerolled": [],
      "notes": []
    }
  ],
  "state_changes": [
    {
      "type": "location",
      "id": "loc.lantern-road",
      "map": "lantern_road",
      "region": "lanternmarch",
      "applied": true
    },
    {
      "type": "flag",
      "id": "core_37_removed_by_hand",
      "value": true,
      "applied": true
    },
    {
      "type": "flag",
      "id": "core_37_removed_by_someone_skilled",
      "value": true,
      "if": "c2.success",
      "applied": false,
      "why": "condition c2.success not met (c2 was failure)"
    },
    {
      "type": "flag",
      "id": "goblin_trail_used_for_weeks",
      "value": true,
      "if": "c3.success",
      "applied": false,
      "why": "condition c3.success not met (c3 was failure)"
    },
    {
      "type": "quest",
      "id": "q.relight-lantern-37",
      "objectives": [
        "Find the missing core of Lantern 37"
      ],
      "applied": true
    },
    {
      "type": "bond",
      "a": "ilsevel",
      "b": "tamsin",
      "trust": 1,
      "note": "Tamsin opened the frozen housing catch with her bare hands while Ilsevel was still looking for the key.",
      "if": "c1.success",
      "applied": true
    },
    {
      "type": "clock",
      "time_of_day": "dusk",
      "applied": true
    }
  ],
  "xp_awarded": 0,
  "loot": [],
  "level_ups": []
}
