{
  "schema": "pqc/episode@1",
  "id": "C01-E007",
  "campaign": 1,
  "episode": 7,
  "title": "The Saint of the Open Hand",
  "seed": "C01-E007-1",
  "attempt": 1,
  "status": "scripted",
  "in_world_date": {
    "year": 1047,
    "month": 9,
    "day": 5,
    "hearthday": null,
    "time_of_day": "morning"
  },
  "checks": [
    {
      "id": "c1",
      "actor": "ilsevel",
      "skill": "history",
      "ability": null,
      "dc": 12,
      "roll": "r0000",
      "success": false,
      "reason": "Recall what the Lamplighters' own histories say about Saint Wenna, the Order's founder, to set beside a village priest's version.",
      "offscreen": false
    },
    {
      "id": "c2",
      "actor": "oriel",
      "skill": "religion",
      "ability": null,
      "dc": 14,
      "roll": "r0001",
      "success": false,
      "reason": "Hold a dead lantern-core and pray over it, trying to understand by faith why the flame will not come back to it.",
      "offscreen": false
    }
  ],
  "encounters": [],
  "rolls": [
    {
      "id": "r0000",
      "index": 0,
      "seed": "C01-E007-1",
      "kind": "d20",
      "notation": "1d20",
      "purpose": "c1: Recall what the Lamplighters' own histories say about Saint Wenna, the Order's founder, to set beside a village prie",
      "actor": "ilsevel",
      "target": null,
      "draws": [
        {
          "counter": 0,
          "sides": 20,
          "value": 3
        }
      ],
      "rolls": [
        3
      ],
      "kept": [
        3
      ],
      "modifier": 5,
      "total": 8,
      "advantage": "none",
      "natural": 3,
      "dc": 12,
      "success": false,
      "critical": false,
      "fumble": false,
      "rerolled": [],
      "notes": []
    },
    {
      "id": "r0001",
      "index": 1,
      "seed": "C01-E007-1",
      "kind": "d20",
      "notation": "1d20",
      "purpose": "c2: Hold a dead lantern-core and pray over it, trying to understand by faith why the flame will not come back to it.",
      "actor": "oriel",
      "target": null,
      "draws": [
        {
          "counter": 1,
          "sides": 20,
          "value": 9
        }
      ],
      "rolls": [
        9
      ],
      "kept": [
        9
      ],
      "modifier": 1,
      "total": 10,
      "advantage": "none",
      "natural": 9,
      "dc": 14,
      "success": false,
      "critical": false,
      "fumble": false,
      "rerolled": [],
      "notes": []
    }
  ],
  "state_changes": [
    {
      "type": "location",
      "id": "loc.crooked-kettle",
      "map": "brindle_cross",
      "region": "lanternmarch",
      "applied": true
    },
    {
      "type": "lantern",
      "id": "lantern_road.041",
      "state": "dead",
      "applied": true
    },
    {
      "type": "item",
      "id": "dead_lantern_core",
      "holder": "party",
      "qty": -3,
      "applied": true
    },
    {
      "type": "flag",
      "id": "dead_cores_on_shrine_altar",
      "value": true,
      "applied": true
    },
    {
      "type": "flag",
      "id": "cores_emptied_on_purpose",
      "value": true,
      "if": "c2.success",
      "applied": false,
      "why": "condition c2.success not met (c2 was failure)"
    },
    {
      "type": "npc",
      "id": "npc.tobin-ashdown",
      "note": "Told the story of Saint Wenna and of finding Oriel at Lantern No. 1; keeps the three dead cores on the shrine altar (C01-E007).",
      "applied": true
    },
    {
      "type": "npc",
      "id": "npc.edda-rook",
      "note": "Sent Brannoc ('Bran Vow') a letter by rider: goblins seen near Wending Mill; look on the way back to the fort and bring help.",
      "applied": true
    },
    {
      "type": "quest",
      "id": "q.wending-mill",
      "title": "Goblins near Wending Mill",
      "giver": "npc.edda-rook",
      "reward_cp": 0,
      "objectives": [
        "Look in on Wending Mill on the road south",
        "Report to Captain Rook at Fort Harrow"
      ],
      "applied": true
    },
    {
      "type": "quest",
      "id": "q.inspect-lanterns",
      "objectives": [
        "Find out why Lantern 41 went dark"
      ],
      "applied": true
    },
    {
      "type": "hook",
      "id": "hook.brass-button",
      "status": "planted",
      "applied": true
    },
    {
      "type": "bond",
      "a": "tamsin",
      "b": "oriel",
      "trust": 1,
      "note": "Tamsin heard the story of the night Father Tobin found Oriel.",
      "applied": true
    },
    {
      "type": "rest",
      "kind": "long",
      "applied": true
    }
  ],
  "xp_awarded": 0,
  "loot": [],
  "level_ups": []
}
